data/modeling/deep_learning_gnn/gnn_molecular_graph_metrics.csv

split,seed,train_n,val_n,test_n,train_positive,val_positive,test_positive,best_epoch,best_val_roc_auc,roc_auc,pr_auc,brier_score,accuracy,balanced_accuracy,sensitivity_recall,specificity,precision,f1,mcc,tn,fp,fn,tp,model_path
random,0,7475,748,1869,3738,374,934,13,0.9859589922502787,0.9800112219308592,0.9820874087823062,0.0531243491424092,0.9293739967897271,0.929375694213835,0.9325481798715204,0.9262032085561497,0.926595744680851,0.9295624332977588,0.8587661390863485,866,69,63,871,
scaffold,0,7475,748,1869,3736,374,936,44,0.9939374874889187,0.9747070840318428,0.9770113142687902,0.0548341611435149,0.9347244515783841,0.9347912716079919,0.8931623931623932,0.9764201500535906,0.9743589743589743,0.9319955406911928,0.8725098474731926,911,22,100,836,
random,1,7475,748,1869,3737,374,935,47,0.9912350939403471,0.9874738059522036,0.9888374378998023,0.05372415131125606,0.9315141787051899,0.9315399237366739,0.8834224598930481,0.9796573875802997,0.9775147928994082,0.9280898876404494,0.8670654613590658,915,19,109,826,
scaffold,1,7474,748,1870,3737,374,935,50,0.9920643998970518,0.9746398238439761,0.9767028790787481,0.06454018016928413,0.9197860962566845,0.9197860962566845,0.8780748663101604,0.9614973262032086,0.9579929988331388,0.9162946428571429,0.842508950021755,899,36,114,821,
random,2,7475,748,1869,3738,374,934,45,0.9898410020303698,0.9880978827193715,0.9887669991442266,0.051058896392951914,0.9347244515783841,0.9347490524338994,0.9807280513918629,0.8887700534759359,0.8980392156862745,0.9375639713408394,0.8731602415023237,831,104,18,916,
scaffold,2,7475,748,1869,3738,374,934,55,0.9883325230918814,0.9792325573406315,0.9837376844350545,0.04889106764597248,0.9427501337613697,0.9427498310984896,0.9421841541755889,0.9433155080213904,0.9431939978563773,0.9426888055704339,0.8855006761799439,882,53,54,880,
random,3,7475,748,1869,3738,374,934,47,0.9901412679802111,0.9862645856473795,0.9872135321233582,0.04030101946602206,0.9502407704654896,0.950234744472054,0.9389721627408993,0.9614973262032086,0.9605695509309967,0.9496480779642664,0.9007077729287954,899,36,57,877,
scaffold,3,7475,748,1869,3738,374,934,53,0.9926935285538621,0.977841266933092,0.981617803325084,0.05598558227231815,0.9341894060995185,0.934173069656128,0.9036402569593148,0.9647058823529412,0.9623717217787914,0.9320817228050801,0.8699944628683868,902,33,90,844,
random,4,7475,748,1869,3738,374,934,53,0.9891975749949955,0.9865955180982264,0.9887272369706959,0.038361281230065325,0.9539860888175495,0.9539769148850896,0.936830835117773,0.9711229946524064,0.9700665188470067,0.9531590413943355,0.908503286234259,908,27,59,875,
scaffold,4,7475,748,1869,3738,374,934,33,0.9896336755411936,0.9730295778034789,0.9759672700696068,0.06069352525054525,0.9192081326912788,0.9191889292216789,0.8832976445396146,0.9550802139037433,0.9515570934256056,0.9161576901721266,0.8405733835736295,893,42,109,825,
random,5,7475,748,1869,3737,374,935,24,0.9879893620063486,0.9880463534450182,0.9886198188758648,0.042378472347101646,0.9406099518459069,0.9406245348051621,0.9133689839572192,0.9678800856531049,0.9660633484162896,0.9389774601429357,0.8825385143856422,904,30,81,854,
scaffold,5,7474,748,1870,3737,374,935,55,0.990134118790929,0.9764374159970259,0.9806157792121685,0.06877019011044642,0.9165775401069519,0.9165775401069518,0.8470588235294118,0.986096256684492,0.9838509316770186,0.9103448275862069,0.8413267811211839,922,13,143,792,
random,6,7475,748,1869,3738,374,934,30,0.9875532614601504,0.9880360475901476,0.9888610388665053,0.038378606346441926,0.9529159978598181,0.952905105978541,0.9325481798715204,0.9732620320855615,0.9720982142857143,0.9519125683060109,0.9065797854883375,910,25,63,871,
scaffold,6,7474,748,1870,3737,374,935,43,0.992679230175298,0.9756624438788641,0.9740915413240184,0.07889724017482597,0.9026737967914439,0.9026737967914439,0.8224598930481284,0.9828877005347594,0.9796178343949045,0.8941860465116279,0.8159156788675331,919,16,166,769,
random,7,7475,748,1869,3737,374,935,42,0.9925934399039149,0.9901017989442225,0.9910358231961015,0.03655847721354919,0.9545211342964152,0.9545236977407277,0.9497326203208556,0.9593147751605996,0.958963282937365,0.9543256313809779,0.9090848718409401,896,38,47,888,
scaffold,7,7475,748,1869,3737,374,935,52,0.9941233664102491,0.9788615465652877,0.9827983825810817,0.055632639073700925,0.9315141787051899,0.9315341982617458,0.8941176470588236,0.9689507494646681,0.9664739884393063,0.9288888888888889,0.8654650759328467,905,29,99,836,
random,8,7475,748,1869,3737,374,935,48,0.9874674711887672,0.9897250626939504,0.9906655278708825,0.03653764839167499,0.9550561797752809,0.9550515865291026,0.9636363636363636,0.9464668094218416,0.9474237644584648,0.9554612937433722,0.9102449391984099,884,50,34,901,
scaffold,8,7474,748,1870,3736,374,936,24,0.9850367468329092,0.9749583630739947,0.9779792226590551,0.05968233336281919,0.9262032085561497,0.9262477351342447,0.8846153846153846,0.9678800856531049,0.965034965034965,0.9230769230769231,0.8554005838690635,904,30,108,828,
random,9,7475,748,1869,3738,374,934,58,0.9942091566816322,0.9915268696538377,0.991961723737407,0.031068109434906815,0.9636169074371321,0.9636163244741152,0.9625267665952891,0.9647058823529412,0.9645922746781116,0.9635584137191854,0.9272358342730144,902,33,35,899,
scaffold,9,7475,748,1869,3737,374,935,30,0.9933369555892362,0.9835278086317261,0.9852289916826055,0.045530736124037956,0.9464954521134297,0.9465023073663961,0.9336898395721925,0.9593147751605996,0.9582875960482986,0.9458288190682557,0.8932869793296258,896,38,62,873,
random,10,7475,748,1869,3737,374,935,44,0.9876462009208156,0.9887208143915538,0.9902066202169305,0.0397335501531255,0.9518459069020867,0.9518561989717047,0.932620320855615,0.9710920770877944,0.9699666295884316,0.95092693565976,0.9043650512914697,907,27,63,872,
scaffold,10,7473,748,1871,3737,374,935,26,0.9891546798593039,0.9816582110699758,0.9849768726541505,0.04975510960153295,0.9326563335114911,0.9326391745509393,0.9005347593582887,0.9647435897435898,0.9622857142857143,0.9303867403314917,0.8670933810750263,903,33,93,842,
random,11,7475,748,1869,3737,374,935,40,0.9918856701650033,0.9872825750896036,0.9883246614622547,0.04436952336926944,0.9459604066345639,0.945977853862978,0.9133689839572192,0.9785867237687366,0.977116704805492,0.9441680486456606,0.8938307179166888,914,20,81,854,
scaffold,11,7474,748,1870,3737,374,935,26,0.9890688895879207,0.9784151677199806,0.9830291709400598,0.08424873471993427,0.8866310160427807,0.8866310160427808,0.7807486631016043,0.9925133689839573,0.9905020352781547,0.8732057416267942,0.79120604813293,928,7,205,730,
random,12,7475,748,1869,3737,374,935,39,0.9907275015013297,0.9916167596102096,0.992107254681692,0.03252245498994307,0.9593365436062066,0.9593313790378912,0.9689839572192513,0.949678800856531,0.950682056663169,0.9597457627118644,0.9188426954242777,887,47,29,906,
scaffold,12,7473,748,1871,3737,374,935,47,0.9938802939746633,0.972168517756753,0.9731527208916821,0.10707754117852603,0.8621058257616248,0.8620412267471091,0.7411764705882353,0.9829059829059829,0.9774330042313117,0.843065693430657,0.7462864762088355,920,16,242,693,
random,13,7475,748,1869,3738,374,934,41,0.987596156595842,0.9907670991308729,0.9912468397705764,0.040685252527952694,0.9502407704654896,0.9502484856118815,0.9646680942184154,0.9358288770053476,0.9375650364203955,0.9509234828496043,0.9008591248308715,875,60,33,901,
scaffold,13,7472,748,1872,3736,374,936,46,0.9892476193199691,0.9737968213529111,0.9730874922411396,0.04753283425254325,0.9412393162393162,0.9412393162393162,0.9198717948717948,0.9626068376068376,0.9609375,0.9399563318777293,0.8832855661638781,901,35,75,861,
random,14,7475,748,1869,3737,374,935,36,0.9926434842288884,0.9896048277204594,0.9904046458080769,0.04081497140212262,0.9507758159443552,0.9507924057300553,0.9197860962566845,0.9817987152034261,0.9806157354618016,0.9492273730684326,0.9032962297705053,917,17,75,860,
scaffold,14,7473,748,1871,3737,374,935,58,0.9858589036003317,0.9654383198500844,0.969630098590373,0.08913847854845239,0.8925708177445216,0.8925230814936698,0.8032085561497326,0.9818376068376068,0.9778645833333334,0.8819729888432178,0.7979405924196868,919,17,184,751,
random,15,7475,748,1869,3738,374,934,33,0.992586290714633,0.9877829815983236,0.9889456296667095,0.041713724001379814,0.9459604066345639,0.9459503715833228,0.9271948608137045,0.9647058823529412,0.9632925472747497,0.944899072558647,0.8925448662388641,902,33,68,866,
scaffold,15,7475,748,1869,3737,374,935,51,0.9884683576882382,0.9778733295926896,0.9821474696796207,0.05816914085132388,0.9325842696629213,0.9326105875482371,0.8834224598930481,0.9817987152034261,0.9798339264531435,0.9291338582677166,0.8693985579610968,917,17,109,826,
random,16,7475,748,1869,3737,374,935,27,0.9921287426005891,0.9897651410184475,0.9915766917748695,0.03646202603483273,0.9555912252541466,0.9555823380549416,0.9721925133689839,0.9389721627408993,0.9409937888198758,0.9563387690689111,0.9116826289924244,877,57,26,909,
scaffold,16,7475,748,1869,3737,374,935,41,0.9864522863107323,0.9808540118402822,0.9844544461971899,0.049801654385932835,0.9341894060995185,0.9341850931534771,0.9422459893048128,0.9261241970021413,0.9273684210526316,0.9347480106100796,0.868489534868818,865,69,54,881,
random,17,7475,748,1869,3737,374,935,34,0.9944093339815265,0.9853370587090199,0.9865353675074628,0.03892890514269911,0.9529159978598181,0.9529188471183685,0.9475935828877006,0.9582441113490364,0.9578378378378378,0.9526881720430107,0.9058843750039729,895,39,49,886,
scaffold,17,7473,748,1871,3736,374,936,53,0.9899339414910349,0.9736345353992414,0.9770896933711736,0.06170799484835829,0.926242650988776,0.926263197586727,0.8878205128205128,0.9647058823529412,0.9618055555555556,0.9233333333333333,0.8550272526562072,902,33,105,831,
random,18,7475,748,1869,3738,374,934,41,0.9858517544110498,0.9870650070423341,0.9881756771845236,0.03530061193013207,0.956661316211878,0.9566592998889258,0.9528907922912205,0.960427807486631,0.9600862998921251,0.9564750134336378,0.9133478846096523,898,37,44,890,
scaffold,18,7540,754,1804,3770,377,902,20,0.9792371718649958,0.9719568733683708,0.9749891130954963,0.06394914147790758,0.9135254988913526,0.9135254988913526,0.9157427937915743,0.9113082039911308,0.9116997792494481,0.9137168141592921,0.8270591301242012,822,80,76,826,
random,42,7475,748,1869,3738,374,934,49,0.9897480625697045,0.9924034398653366,0.9932849366760096,0.03144046641243247,0.9588014981273408,0.9588017726070377,0.9593147751605996,0.9582887700534759,0.9582887700534759,0.9588014981273408,0.9176035452140755,896,39,38,896,/home/looktei/Desktop/test1/script/data/modeling/deep_learning_gnn/gnn_molecular_graph_random_seed42.pt
scaffold,42,7475,748,1869,3737,374,935,56,0.9897266150018588,0.9800638963001981,0.9834589356050323,0.05029368412950272,0.9406099518459069,0.940627970090119,0.906951871657754,0.974304068522484,0.9724770642201835,0.9385722191477587,0.8832333909207166,910,24,87,848,/home/looktei/Desktop/test1/script/data/modeling/deep_learning_gnn/gnn_molecular_graph_scaffold_seed42.pt

data/modeling/final_model_comparison/final_model_comparison_summary.md

### Random split

- roc_auc: Molecular Graph GNN (highest, 0.9924)
- pr_auc: Molecular Graph GNN (highest, 0.9933)
- mcc: Molecular Graph GNN (highest, 0.9176)
- balanced_accuracy: Molecular Graph GNN (highest, 0.9588)
- brier_score: Molecular Graph GNN (lowest, 0.0314)

### Scaffold split

- roc_auc: Molecular Graph GNN (highest, 0.9801)
- pr_auc: Molecular Graph GNN (highest, 0.9835)
- mcc: Molecular Graph GNN (highest, 0.8832)
- balanced_accuracy: Molecular Graph GNN (highest, 0.9406)
- brier_score: Molecular Graph GNN (lowest, 0.0503)